{
  "name": "Sum to Product",
  "description": "Transform addition into multiplication: compute 3 Ã— 4 = 12 using only ADD.",
  "difficulty": "advanced",
  "initialState": {
    "multiplier": 3,
    "count": 4,
    "result": 0,
    "temp": 0
  },
  "goalState": {
    "result": 12,
    "multiplier": 3,
    "count": 0,
    "temp": 0
  },
  "maxMoves": 30,
  "optimalMoves": 16,
  "allowedInstructions": ["ADD", "SUB", "SWAP"],
  "hints": [
    {
      "moveNumber": 0,
      "text": "Multiplication is repeated addition: 3+3+3+3 = 12."
    },
    {
      "moveNumber": 8,
      "text": "Use count as a counter, decrement it as you add."
    }
  ],
  "metadata": {
    "author": "Idaptik Team",
    "created": "2025-11-22",
    "tags": ["arithmetic", "advanced", "multiplication"]
  }
}
